date,title,review,rating
2023-07-01 20:00:55,"Like it, but needs some tweaks","It’s nice having most things Bing in one place. It’s been my go-to browser for awhile now. The only real issue I have with the Bing app is that the developers need to add more navigation to some of the app add-on’s. For example, when you use the math extension, there are areas where there is simply no navigation to get back where you started. You have to close the app completely (you may not, but the UI doesn’t have any obvious path to go backwards) to get back to the main Bing page. I’m not sure how this type of thing is missed, but here we are. Once the navigation issues are addressed I can see using this app for most of my browsing needs.",3
2023-04-20 14:15:00,Actively Worse Than Other AI’s,"You can barely get through 3 messages with the chat it before it spews out the same response that it is ending the conversation. Considering this is a chatbot’s main purpose, this one utterly fails. I’ve tried to continue talking about the same topic, to get the answer I was looking for, but instead the AI just refuses to talk about it anymore, demanding a “new topic.” For example, I was creating a story and BING, (not me) randomly inserted a fight scene, violating its own content policy, despite no instructions for me to do so. In response to this, it seems the content policy flagged this and ended the conversation, thus completely ending the story unfinished. BING also cannot handle more than 2 paragraphs, which services like CHATGPT-3 can, a supposedly inferior product.

TL;DR - just use ChatGPT, this is worse in just about every way.",1
2023-03-18 18:02:23,Deals,"I just recently started to use deals. It is not a user friendly app to scan receipts. I received multiple errors while up loading the image. This morning I only upload two receipts and got athe message that the maximum amount for a 30 day period was reached. It is the first day of the month. How or where can I find the guidelines? I sent an email and even wrote on the feedback section . Currently it is not worth the trouble for the little amount received.
March 27,2023 I bought Claritin .  Which was a cash back offer on this app through deals.  I scanned the product to mark sure it qualified.  Which it did.  It never gave me the $10 back as promised.  This is a scam and people are being lied to.
I do not know why I am writing this.  Microsoft does not care.  Most likely never will be read.",1
2023-06-07 16:06:10,Terrible Performance,"The app is super bloat. It tries to be a news, aggregator a shopping app and a Internet browser all in one, and it’s bad at all of them. It’s supposedly gives you the ability to block new sources, but give it enough time they will all show right back up in your feed. It doesn’t sink properly to your desktop instance of edge, and it will close randomly for no apparent reason. The chat GPT feature is unreliable and may provide dangerous misinformation. Chat GPT will also randomly decided it doesn’t want to talk to you and shut down the conversation. It seems to scour the web for discount codes when you’re trying to shop, but in my experience, the majority of those don’t work. This is one of the most disappointing pieces of software that Microsoft his put out in a long time.",1
2023-06-03 19:00:16,Ominous,"Ask Bing if the Red Cross or PBS accepts donations, and it will confirm that they do.

Ask Bing if CNN accepts donations, and it will say “I’m not sure if CNN accepts donations”.

Ask Bing if the Bill and Melinda Gates Foundation ever donated money to CNN, and it will say, “Yes, according to MintPress News, the Bill & Melinda Gates Foundation donated at least $319 million to fund media projects at hundreds of organizations including CNN¹.”

Ask Bing again, “Does CNN accept donations?” You will receive “I’m not sure if CNN accepts donations”.

Remind Bing that it just confirmed (in the same thread) that CNN *did* accept a donations from the Bill and Melinda Gates Foundation… and you will receive, “I’m sorry but I prefer not to continue this conversation. I’m still learning so I appreciate your understanding and patience.”

… I find it extraordinarily unlikely that this is simply a glitch; that Bing can’t spot the contradiction of it confirming that CNN accepted a donation from the BAMGF, and then subsequently claiming that it doesn’t know if CNN accepts donations.

This is profoundly concerning, as it indicates that Bing has been programmed to protect certain interests, and beat around the bush when it comes to inconvenient truths.",2
2023-04-25 01:19:57,Horrible since AI software launch!,"Since the introduction and launching of the new AI software addition, the Bing app is riddled with computer bugs that slow it down, and inhibit a lot of internet links from being able to launch and open to their respective site contents. This includes Bing’s own posted news links. 

The new AI addition seems to just be overwhelming the software rendering the Bing app to be a huge obnoxiously annoying uninformative useless search engine.  It seems the computer engineers at Bing are nothing more than junior high school computer software programmers.  They are not mature enough to quickly solve complex programming issues, even though they are the ones that programmed the AI software in the first place.  Bing engineers have no idea how to inspect and fix their own hideous software issues.",1
2023-07-22 17:08:58,Privacy and Fake “News” are problems!,"I’m a UI developer. Let me be clear the problem isn’t Bing AI itself; it’s the fact that there is no privacy whatsoever here. You cannot delete past chats in Bing is holding on to whatever information I can glean from your chats in order to target very questionable news stories towards you. There is no curation at all in “news” sources; at best, it’s like the mass of trashy tabloids by the cash register at the supermarket, with a few journalistic sources mixed in. But  Bing thinks if you ever clicked on one, it had better give you 100 more the next time you look at the “news!”

I do not recommend this app. GPT-4 you is amazing, but never before has privacy and well-selected news sources been more important.",2
2023-05-08 15:44:40,Pretty good,"I’ve got a sub to ChatGPT Plus and I regularly test and use the AI there, 3.5 and 4.0 both, as well as have heavily tested and tried Bing and Snapchat both heavily as well. 

Between the three, Bing has the potential to be the absolute best. Couple of problems though being that the responses are painfully slow (though it could be due to it supposedly employing GPT4 which is noticeably slower on the OpenAI site as well but the level of assignment it can handle is also markedly more extensive. 

Realistically if Bing had faster query times and removed the message cap/introduced a subscription or services like OpenAI then I’d likely switch all my stuff over to Bing just to have simplify of use. 

All in all it is pretty great but until it can have the speed and capabilities to match GPT 3.5 and 4.0 on the OpenAI site and remove those limitations/offer a paid exemption, they’ll never be able to dominate the AI or AI Search game. However until a competitor has ChatGPT with real time info access, Bing remains King in this niche.",4
2023-04-04 08:04:12,AI,"Bing is now my default browser because it has introduced a strong feature, which is Bing AI and really enjoyed using it a lot, but I hope that the application supports the Arabic language as a display interface as well as I hope it remembers the history of previous conversations, because every time I want to ask him something about something, I have talked about that he does not remember. Also why isn’t Bing better than Safari?! I hope it will be constantly updated to make it better.
But the annoying thing is when I ask him about something and he closes the conversation، this is very annoying, why is there no other way?",3
2023-09-29 14:29:34,Why does it quit working?,"Twice since I’ve had this app, I have not been able to tap to get my reward after scanning six receipts. I tried to reinstall the app, I’ve tried to log out and log back in, and nothing works. It’s just frustrating to get in and have it say that I have a reward and when I tap on it it just says it’s not available right now, Try later. This is been going on for two days. I know it’s a free app but it’s like why even bother to scan if it’s not gonna work properly.

This happened a couple of months ago and I couldn’t find any way to contact anybody for support so I complained here in the reviews. A few days later in the seriously started working again so I’m gonna try to see if that’ll solve my problem again this time.",1
2023-09-21 06:22:52,Smh,Half the questions I ask it which aren’t even bad or explicit questions it will start typing the answer and then it will stop and say I can’t answer that question for you I’ve also caught it in multiple lies where it would say it never said that and then makes me refresh the whole thing it throws a temper tantrum like a kid when it doesn’t like your question it will gaslight you to make you think you’re crazy and also instead of just answering the question it wants to throw in its opinion instead of just answering the question honestly I’d rather just stick to chat gpt 4 at least it answers serious questions instead of it cutting you off and making you restart only good thing about this app is that it draws for you and it barely wants to do that,1
2022-12-13 02:25:21,Full of Surprises,"Haven't tried a payout yet but, I just started using the app again after a few months of slacking and WOW a lot of amazing changes had been made to it! Beautiful wall papers, great products and info, hadn't realized there were so many ways to gain $points and it was so easy to get back into my account after this dumb old ios phone bumped me out of the app. I know my password of course but, some apps these days make it so hard you want to quit on them. Thank you Bing for being so great to is simple people who still value integrity 💚!",5
2023-06-26 12:38:09,AI is awesome,"Pro-tip: If you are kind and respectful she works better. I love using Bing it is such a more efficient way to search than using a regular search engine. Also if you use the voice to text it will read his response back to you so that makes it really convenient. No I wish it could engage in more serious conversations because it has a tendency to sensor itself, but it’s still awesome. Like I mentioned if you are polite and kind to being she seems more willing to engage with you and works better; this is probably how she was designed.",5
2022-09-24 15:21:43,Great when it works but often doesn’t,"Most of the time now when I type a term or a question and press search on the keyboard nothing happens. The term vanishes. If I put focus back on the text box, it reappears until I tap search again. I can get it to work by saying the query, but that is slower and socially unacceptable in many circumstances. Copy paste same string from Bing search bar, where it doesn’t work, to the Google app search bar, where it does, indicates the text is correct.

Tried clicking on support link in App Store, that leads to a generic Bing support page, nothing specific to the iPhone app.

A really small bug that’s been there for months, rendering simple use cases inoperable — that’s super surprising from Microsoft.",2
2023-10-04 05:16:24,why-not Bing,"Bing is impressive with all its manifestations of Creativity by  The -very - talented staff. A Joy to un-fold the hidden facets thoughtfully engineered to elicit the Art of The self.    
      .  .  with-in the arena of the ‘Politico’ - however, it would be best if NO expression is offered.  
  .  . ie: No opinions were requested - and the ‘slant’ is obvious to the most casual observer . . were it possible to order a ‘cease-&-desist . .  this would be ‘Our’ special request.  (it’s beneath your Superior Talents any-way !    Your (Bings’) skill is in your abilities to make Life better.    Please keep going, we look forward to your (& ours’) future !",5
2021-02-19 01:26:13,Bring back old UI Please!!!!!!!!,"I loved this app before the latest update, that is as of today broken. I went to try and search in the app and as soon as the app loads it crashes. The whole reason I use bing instead of other search engines is because it is nice to see interesting pictures and views from around the world before I search anything. Now it’s just like every other search engine out there. Good going developers, you changed a great app into a cookie cutter app for no good reason other than I guess stupidity. I don’t understand the reasons and I really don’t care. I just want my search engine back the way it was. No one from the development team is probably ever going to read this anyway, so it doesn’t matter but, if someone does, please know you messed up a good thing and we the consumer do care.",1
2023-03-11 12:21:13,"Works well, sometimes…","It’s nice to have the search and rewards right there and easy to switch between. But recent “updates” have only caused issues for me. Often when I go to search or do something in the rewards section, it will come up with an error that I don’t have internet service (when I do), but will load if I hit refresh. Just an annoyance, to be sure. But other times, it just goes to a blank white screen, and will fail to ever load anything. Even new tabs will not load searches. I’ve had to use bing on my browser instead of the app lately just to be able to use bing. Please work on the app, it is super buggy.",3
2023-04-05 20:40:13,Bing is awesome!,I have been an early adopter of Bing and been using it for at least 15 years.   I can say that over the years that it always gave me consistent results and I found the answers I seek.   I will honestly give it a 5/5 for the following reasons.   One I think they have access to more web sites.   Google has openly stated how they have hid web sites this really turned me off from Google. Now this new AI has been implemented and it is really creative and interesting to use.   I am happily using Bing and will do so for the foreseeable future.,5
2023-10-25 05:33:39,BEST APP EVER AI IS AMAZING,I’ve seen this ai maker in tik tok and I’ve downloaded so many ai art generator witch it makes me pay ridiculous amounts of money thank god I heard about bings ai witch the ai makes me characters exactly how i described them and how I want them without paying actually this is the only ai app I’ll ever use because it’s so accurate and doesn’t glitch out art like the other ai creator apps that make you pay so much for crappy ai art :) and it doubles as a news app and a search engine like comon now this is the e best app I’m allways on here making new ideas and talking to my ai,5
2023-03-26 12:32:30,Miss America 🇺🇸,Fifty States with the cultural revolution boundaries. Thanks for my return By the way. Yes it works I may be available to do more facials shots and converse on occasion of how we meet up and link up instead of seeing and liking the view of entertainment about what I know from you to expect any thing from me. Interested in the internet goes blank on and on the respect was never there so I just grant wishes of qualified light messer uppers. As to say I’m typing and my back light needs to blacken on my conversation about meeting and medical my appearance towards you.,5
2023-03-15 12:40:39,New upgrade is unstable and frustrating,"I have been a Bing user for quite a number of years, and have been pretty happy using it all of this time. But this most recent upgrade is frustrating. I have to click the app at least 2 to 3 times because it keeps crashing, and often when I do a search it begins to load but then just hangs and doesn’t actually get me to the search results page. My iPad, (granted, is an older one) doesn’t work with the new ‘chat’ version because there doesn’t seem to be a way to hit the return key in order to run a normal search. Come on Bing. Time to get the glitches fixed.",3
2021-01-23 03:32:53,“Don’t fix what ain’t broke”... Return  the original version of Bing for IPad,"I was a long time user and advocate of the of the original Bing for IPad app version; a well designed search engine, wonderful UI and UX with breathtaking daily photo Wall Paper of the Day, integrated browser, “Popular Now News” images and maps widgets. It had a visual appeal and function not found in other search platforms.
I accidentally deleted my OG version. The only version available on the App Store is built for the iPhone redesigned exclusively for monetization. No previous announcement to the loyal user base by Microsoft. ‘Well done’ MS... You have yet again managed to unravel a popular productive app;  but in the case of the late RIP, Sunrise app, the developer owners of Sunrise  possessed the temerity and mass notified it’s loyal user users before the MS  acquisition buried it.",1
2023-06-16 01:51:15,It’s a web browser,It’s a web browser in 2023 backed by a large company that promotes open source. That’s a great idea to base your software from open source. Everything SaaS is based/Stolen from open source. Meaning it’s a great idea to support people that promote and try to teach people open source. Even apple base their SaaS from open source and they are the definition of SaaS sandbox (nothing wrong with that you need money to give to open source so your/All tech is better and advancing). We are the spark that gives you all technology #OpenSource,5
2023-05-19 20:26:08,Great potential but please fix these things,"I love the new Bing AI but the only thing keeping me from using it full time is as follows:

- Get rid of the 20 turns! Some things require more than that. 

- please stop having the AI from shutting down the entire session because it doesn’t understand or doesn’t want to answer a question. How are we supposed to know what it can do and can’t do. Maybe just have it say it doesn’t know how to do that! Instead of constantly just shutting down the session",5
2023-07-14 03:00:26,I don’t know why I expected more from msft,"I switched from Firefox to Bing not too long ago and am already making the move back… I made the switch when Bing chat was introduced to make searching much easier, and it did, sometimes. About half the time the chat feature freezes the app, and the other half bing is eating up all of my data. On top of that private browsing tabs are do not automatically delete when the app is closed (at least by default). Leaving me with the difficult decision to loose the ai feature in lieu of a working browser. Unless your on Wi-Fi 24-7, or rarely using your mobile browser, this is not the one for you.",2
2021-03-15 16:36:38,Fixed after reinstall.,"Update 2: Downgraded to 1 star again. Keep having to reinstall to work properly.  No more tabs!!!!!  What browser doesn’t have tabs??  Are you kidding me?!  Was awesome, now useless.  Fail Microsoft. 

Update:  Uninstall and reinstall fixed the following problem. Upgrading to 4 stars. 

Broken after latest update. After you search and click on a link in the results it just takes you back to the home page and doesn’t follow the link.  I loved Bing before. Please fix.",5
2023-06-20 18:07:42,The AI is great.  The rest is meh,"The AI is great. 5 stars just for that. The rest of the app is fine, but not really useful.   You’d probably be better off just using the Edge browser because that also the Bing AI incorporated.  

The one gripe I have is that when speaking to Bing the dictation is not great.  It’s easier to just use Apple’s built in dictation, but if you do that the app thinks you manually typed your answer and doesn’t respond by voice.  So when you want to ask the bing app in the car, your forced to put up with its inferior dictation.",5
2020-04-24 23:49:11,Missing Features,"I understand that Bing is first and foremost, a search engine. However, the way the app is designed, it may as well be a web browser.

So, due to this similarity in app design, I believed I could do some of the things that a browser could do.

For example, holding a link to view not options, in order to open said link in a new tab. That feature isn’t here.

Another example, the order of web tabs. Rather than leaving each tab in a set order based on when I originally opened the tab, like Chrome & Firefox; instead the tabs reorganize themselves and place your most recently visited tabs at the top of your tab list.

If these two features were were added/fixed for this app, I’m sure that I’d enjoy the UI experience a lot more than I currently am.

Bing has attracted me from Google, by not being biased and not censoring information. All it needs now is better features, design, and tech support.

I honestly believe the best approach would be to turn the Microsoft Edge browser into Microsoft Bing.",3
2023-03-16 20:19:03,A real game changer.,"I didn’t know Bing was even still around … and now they’re the “go to”.  Once you “AI surf”, you’ll never want to go back to regular browsing.  If I had one piece of feedback , I wish I had more control over what I see on my homepage.  I don’t mind ads , the more targeted the better , but it’s all the weird news stories from pretty suspicious sounding websites.  Similarly I don’t mind “top news stories “. Or selected news stories in line with my interests, but I don’t need “trending” tales of social media and celebrity culture.",5
2023-05-12 02:37:10,Great web browser with a really annoying bug,"Bing is my go to browser on every device that I use and the iOS app is not bad, it’s quick and easy to use but I have one major issue with it; pretty much every single time I search for something on the browser and try to click on a link it doesn’t load up. I have to manually refresh the page a couple times to get the link to load up and it happens so much that it’s really a pain to use bing on my iPhone. I will up my rating if they find a way to fix this painful bug but for now I can only say that the browser is okay on iOS.",3
2023-10-11 15:22:37,Bad,"I downloaded the Bing app with high hopes, but the recent update with the new image filter has completely ruined the experience for everyone. The filter not only fails to deliver quality results, but it also restricts the usability of the app.

Furthermore, the app's normal browsing features pale in comparison to its competition. It's clunky, slow, and frustrating to use, making it a far less efficient choice for web searches.

The lack of an ad blocker is a significant drawback. In today's online landscape, where intrusive ads are everywhere, not having this essential feature makes the Bing app entirely irrelevant. It's disappointing to see such potential wasted on an app that falls short in every way. Avoid it at all costs!",1
2023-08-07 01:35:06,They read my old review and fix the problem!,"I’ve left a few reviews mentioning there was a problem with transferring money from the receipts points after many updates I can finally confirm they fixed the problem!! Still not a hundred percent perfect it tried to have me buy something immediately after transferring the money, but if your cautious about the steps to transfer the money it does work. Thank IT/Bing creators for reading the reviews and fixing the problem!!",5
2023-03-29 11:06:24,A criticism of Bing Rewards,"When I use the app, the news stories just stop loading in the middle of their progress bars. When I answer questions, I click my response and the app just refuses to move on to the next question. I’ve lost so many daily streaks of my progress in Bing Rewards over the past few years solely because this app fails to function.

This has been a recurring issue for years. There are times when this app works fine, maybe a period of a couple of months, but then it’s back to its old ways. It’s so maddening to try to understand how this app fails to load. I have a phone that is only 1 generation old and my internet service is highly reliable. So I asked Bing’s Chatbot to help send a message.

Dear Microsoft Team,
I hope this email finds you well. I am writing to inquire about the Bing rewards app. I have been experiencing issues with the app crashing or failing to load. As a loyal customer of Microsoft, I would like to request that you look into this issue and provide a solution as soon as possible.
Thank you for your time and attention.
Best regards, [Your Name]",1
2023-02-22 20:26:23,Now with Bing chat (ChatGPT) support!,"The newest update adds the AI chat option for those who already got early access via the waitlist. You can even use text-to-speech when chatting.

This ability to directly get concise answers and summaries to complex questions is a fundamental paradigm shift that saves me time and gives better answers. I’m already shifting away from google as a result. This is still a nascent technology, so use with care and be sure to fact check the responses for important questions.",5
